{"$defs":{"hash":{"maxLength":64,"pattern":"^[0-9a-f]{64}$","type":"string"},"id128":{"maxLength":128,"pattern":"^[A-Za-z0-9][A-Za-z0-9._:-]{0,127}$","type":"string"},"id64":{"maxLength":64,"pattern":"^[A-Za-z0-9][A-Za-z0-9._:-]{0,63}$","type":"string"}},"$id":"performanceEvaluation.v1","$schema":"https://json-schema.org/draft/2020-12/schema","additionalProperties":false,"properties":{"candidate":{"additionalProperties":false,"properties":{"appBundleContentHash":{"$ref":"#/$defs/hash"},"appVersion":{"$ref":"#/$defs/id128"},"buildID":{"$ref":"#/$defs/id128"}},"required":["appBundleContentHash","appVersion","buildID"],"type":"object"},"evaluationID":{"$ref":"#/$defs/id64"},"evidenceStoreBindingID":{"$ref":"#/$defs/id128"},"measurementProfileHash":{"$ref":"#/$defs/hash"},"measurementProfileID":{"$ref":"#/$defs/id128"},"metricsArtifactID":{"$ref":"#/$defs/id128"},"metricsArtifactSHA256":{"$ref":"#/$defs/hash"},"overallOutcome":{"enum":["failed","passed","unknown"],"type":"string"},"performanceContract":{"additionalProperties":false,"properties":{"revision":{"$ref":"#/$defs/id128"},"sha256":{"$ref":"#/$defs/hash"}},"required":["revision","sha256"],"type":"object"},"releaseFlowID":{"$ref":"#/$defs/id64"},"ruleResults":{"items":{"additionalProperties":false,"properties":{"applicability":{"enum":["applicable","notApplicable"],"type":"string"},"canonicalUnitID":{"$ref":"#/$defs/id128"},"comparator":{"enum":["greaterThanOrEqual","lessThanOrEqual"],"type":"string"},"limitScaledValue":{"type":"integer"},"metricID":{"$ref":"#/$defs/id128"},"observedScaledValue":{"type":"integer"},"outcome":{"enum":["failed","passed","unknown"],"type":"string"},"reasonCode":{"$ref":"#/$defs/id128"},"ruleID":{"$ref":"#/$defs/id128"},"statisticID":{"$ref":"#/$defs/id128"}},"required":["applicability","canonicalUnitID","metricID","outcome","ruleID","statisticID"],"type":"object"},"maxItems":65536,"minItems":1,"type":"array"},"schemaVersion":{"const":1,"type":"integer"},"thresholdProfileHash":{"$ref":"#/$defs/hash"},"thresholdProfileID":{"$ref":"#/$defs/id128"},"thresholdSetID":{"$ref":"#/$defs/id128"}},"required":["candidate","evaluationID","evidenceStoreBindingID","measurementProfileHash","measurementProfileID","metricsArtifactID","metricsArtifactSHA256","overallOutcome","performanceContract","releaseFlowID","ruleResults","schemaVersion","thresholdProfileHash","thresholdProfileID","thresholdSetID"],"type":"object","x-pulsephone-maxEncodedBytes":67108864}