{"candidate":{"appBundleContentHash":"bbbbbbbbbbbbbbbbbbbbbbbbbbbbbbbbbbbbbbbbbbbbbbbbbbbbbbbbbbbbbbbb","appVersion":"0.1.0","buildID":"1"},"evaluationID":"evaluation.synthetic.performance.v1","evidenceStoreBindingID":"store.synthetic.durable.v1","measurementProfileHash":"d5fbde770d086cbf3db2662578c8e234c01a5cf6dae9eacbfea68fdca55af44d","measurementProfileID":"measurement.synthetic.single-live.v1","metricsArtifactID":"metrics-threshold-synthetic-v1","metricsArtifactSHA256":"c6d358e0cef6e75500176741be00797723bcce51eee4f545ee2b1f93fe8d7b59","overallOutcome":"passed","performanceContract":{"revision":"performance-metrics.v1-20260720","sha256":"26e473c469fa5526912c124c43856280ef40be808c741230dcd0f24de9711480"},"releaseFlowID":"flow-synthetic-performance-v1","ruleResults":[{"applicability":"applicable","canonicalUnitID":"microseconds","comparator":"lessThanOrEqual","limitScaledValue":1000000,"metricID":"controlReconnectMs","observedScaledValue":500000,"outcome":"passed","ruleID":"controlReconnectMs.p95","statisticID":"p95"},{"applicability":"applicable","canonicalUnitID":"milliPercent","comparator":"lessThanOrEqual","limitScaledValue":50000,"metricID":"cpuTotalPercent","observedScaledValue":25000,"outcome":"passed","ruleID":"cpuTotalPercent.p95","statisticID":"p95"},{"applicability":"applicable","canonicalUnitID":"microseconds","comparator":"lessThanOrEqual","limitScaledValue":20000,"metricID":"hostVideoPipelineLatencyMs","observedScaledValue":12000,"outcome":"passed","ruleID":"hostVideoPipelineLatencyMs.p95","statisticID":"p95"},{"applicability":"applicable","canonicalUnitID":"milliFramesPerSecond","comparator":"greaterThanOrEqual","limitScaledValue":55000,"metricID":"previewFPS","observedScaledValue":59000,"outcome":"passed","ruleID":"previewFPS.p05","statisticID":"p05"},{"applicability":"applicable","canonicalUnitID":"kibibytesPerHour","comparator":"lessThanOrEqual","limitScaledValue":4096,"metricID":"rssGrowthMiBPerHour","observedScaledValue":1024,"outcome":"passed","ruleID":"rssGrowthMiBPerHour.value","statisticID":"value"},{"applicability":"applicable","canonicalUnitID":"kibibytes","comparator":"lessThanOrEqual","limitScaledValue":524288,"metricID":"rssTotalMiB","observedScaledValue":262144,"outcome":"passed","ruleID":"rssTotalMiB.p95","statisticID":"p95"},{"applicability":"applicable","canonicalUnitID":"microseconds","comparator":"lessThanOrEqual","limitScaledValue":30000,"metricID":"touchDeliveryLatencyMs","observedScaledValue":20000,"outcome":"passed","ruleID":"touchDeliveryLatencyMs.p95","statisticID":"p95"},{"applicability":"applicable","canonicalUnitID":"microseconds","comparator":"lessThanOrEqual","limitScaledValue":1500000,"metricID":"videoReconnectMs","observedScaledValue":700000,"outcome":"passed","ruleID":"videoReconnectMs.p95","statisticID":"p95"}],"schemaVersion":1,"thresholdProfileHash":"245acfc431b3c315892bee6c77f75177599211d129503bcadd8eead8e161539e","thresholdProfileID":"threshold.synthetic.performance.v1","thresholdSetID":"threshold.synthetic.iphone.v1"}